skills,education,college_name,degree,designation,experience,company_names,total_experience,education_section,experience_section,label,resume
"Aerospace,Drive,Pmp,Antennas,Infrastructure,Excel,Bids,Mechanics,Wireless,Utilities,Scrum,Internet,Word,Availability,Project,Water,Office,Customer,Deliverables,Application,Ms project,Leadership,Renovation,Completion,Problem management,Itil,Technology,Insurance,Cable,Scada,Led,Reviews,Savings,Agenda,Pmi,Vendors,Powerpoint,Agile,Directors,Preparation,Real estate,Testing,Collaboration,Microsoft word,Visio,Rfp,Cables,Sponsorship,Strategic vision,Outlook,Smartsheet,Progression,Contractors,Lessons,Sharepoint,Status,Security,Recruiting,Command,Design,Coordinated,Construction,Credentials,Microsoft,Branding,Timelines,Competitive advantage,Teams,Gulfstream,Relocation,Technology solutions,Communications,Milestones",['MS'],,,"['PROJECT MANAGER', 'Project Coordinator', 'Project Manager/Billing Support Manager', 'IT Project Manager', 'Project Manager Consultant', 'Project Manager']","Project Management Institute (PMI), Savannah Chapter	Savannah, GA		12/2016 – Present
Project Manager/VP of Volunteers
▪ Chairing the planning committee for the “2018 Meet me in Savannah Leadership Conference”.
▪ Defining conference goals, objectives and target audience.
▪ Recruiting conference committee/assigning preliminary roles and responsibilities.
▪ Developing initial budget for each component and pricing model for delegate fees.
▪ Communicating/releasing final conference agenda and executing/monitoring sponsorship deliverables.
▪ Developing marketing plan and objectives and identifying logistics needs.
ATN international				Rincon, GA				04/2016 – 11/2016
IT Project Manager/Billing Support Manager
▪ Managed the Billing Support Team for One Communications – cellular, internet and cable service provider in Bermuda with 4 direct reports.
▪ Led large packaged application implementation project for the billing system.
▪ Introduced, trained and mentored the local office in Project Management methodology and tools.
▪ Executed process improvements, software upgrades, re-branding and integration projects.
▪ Performed QA and UAT testing.
▪ Ensured that Billing Support Team members are maintaining the availability, integrity and accuracy of One Communications systems.
▪ Monitored internal tracking systems to ensure that customer issues are getting resolved in the appropriate time frames.
HCL America (Gulfstream Aerospace)		Savannah, GA				8/2012 – 12/2015
IT Project Manager
▪ Planned, executed and finalized infrastructure IT projects per strict deadlines and within budget.
▪ Worked with project sponsor and stakeholders to understand and document scope, goals, deliverables, resources and timelines, to ensure projects deliver on time, scope, budget, quality and within expectations and strategic vision.
▪ Tracked and reported on project milestones and provided status reports to sponsor and management.
▪ Developed tools and best practices for project management, project execution and project transition and continuity.
▪ Managed project team and third-party contractors, identified, assessed and minimized project risks until successful project completion.
▪ Vendor management – selected vendors trough RFP projects, keeping track of bids, vendor performance, previous contract terms and alternative providers.
▪Coordinate project management requirements with Legal, EHS, Real Estate and Facilities for IT infrastructure internal and international group moves and new office set-ups.
•Led SCADA software implementation project at various Gulfstream water pump locations.
•Directed in collaboration with Verizon Wireless a major improvement project (3 million dollars budget) that involved installing fiber optic cables, replacing antennas, connecting to network, reviewing contracts, keeping track and selecting subcontractors and third-party vendors.
•Drove various projects such as: voice command implementation, major hardware replacement (over 1,200 computers), security camera replacement and security software implementation, throughout all Gulfstream locations in the US.
Craiovan Consulting SRL			Timisoara, Romania			6/2009 – 5/2011
Project Manager Consultant
▪ Managed international relocation, construction and remodel projects.
▪ Provided support with the preparation of design, development and construction of new and major renovation projects.
▪ Interacted with governmental agencies, utilities and sub-contractors to implement the company’s real estate requirements.
▪ Performed punch list completion, financial close-out and transfer of property to customer.
▪ Defined and implemented project standards and processes for all the projects.
▪ Tracked projected versus actual project performance and informed management of accomplishments and major problem areas as well as budget and schedule status.
▪ Conducted post implementation project reviews to evaluate sustaining support and document lessons learned.
▪ Led cross-functional and virtual teams and meetings.
UnitedHealth Group				Hartford, CT				8/2002 - 5/2008
Project Coordinator
▪ Acted as a Green Belt on Six Sigma Projects involving the improvement of pharmacy submissions.
▪ Coordinated and tracked status of multiple projects for the IT Coding Department.
▪ Traced and resolved escalated ID card issues for the Key Accounts Department.
▪ Achieved savings of over $800,000 on an Operational Excellence Six Sigma Project.
▪ Collected, tracked, analyzed and reported data.
▪ Generated, analyzed and run complex reports on a daily and weekly basis as well as ad hoc reports.
▪ Researched and analyzed various projects.
▪ Hired, trained and supervised the temporary staff.","['▪ Acted', '▪ Managed international relocation', '▪ Planned', '▪ Managed the Billing']",0.0,"Universitatea de Vest, Romania - BA - Business and Management
PMI-Certified Project Management Professional (PMP)
Six Sigma Green Belt
The George Washington University School of Business - Project Management
Liceul Industrial,Romania - Mechanics.","Project Management Institute (PMI), Savannah Chapter	Savannah, GA		12/2016 – Present
Project Manager/VP of Volunteers
▪ Chairing the planning committee for the “2018 Meet me in Savannah Leadership Conference”.
▪ Defining conference goals, objectives and target audience.
▪ Recruiting conference committee/assigning preliminary roles and responsibilities.
▪ Developing initial budget for each component and pricing model for delegate fees.
▪ Communicating/releasing final conference agenda and executing/monitoring sponsorship deliverables.
▪ Developing marketing plan and objectives and identifying logistics needs.
ATN international				Rincon, GA				04/2016 – 11/2016
IT Project Manager/Billing Support Manager
▪ Managed the Billing Support Team for One Communications – cellular, internet and cable service provider in Bermuda with 4 direct reports.
▪ Led large packaged application implementation project for the billing system.
▪ Introduced, trained and mentored the local office in Project Management methodology and tools.
▪ Executed process improvements, software upgrades, re-branding and integration projects.
▪ Performed QA and UAT testing.
▪ Ensured that Billing Support Team members are maintaining the availability, integrity and accuracy of One Communications systems.
▪ Monitored internal tracking systems to ensure that customer issues are getting resolved in the appropriate time frames.
HCL America (Gulfstream Aerospace)		Savannah, GA				8/2012 – 12/2015
IT Project Manager
▪ Planned, executed and finalized infrastructure IT projects per strict deadlines and within budget.
▪ Worked with project sponsor and stakeholders to understand and document scope, goals, deliverables, resources and timelines, to ensure projects deliver on time, scope, budget, quality and within expectations and strategic vision.
▪ Tracked and reported on project milestones and provided status reports to sponsor and management.
▪ Developed tools and best practices for project management, project execution and project transition and continuity.
▪ Managed project team and third-party contractors, identified, assessed and minimized project risks until successful project completion.
▪ Vendor management – selected vendors trough RFP projects, keeping track of bids, vendor performance, previous contract terms and alternative providers.
▪Coordinate project management requirements with Legal, EHS, Real Estate and Facilities for IT infrastructure internal and international group moves and new office set-ups.
•Led SCADA software implementation project at various Gulfstream water pump locations.
•Directed in collaboration with Verizon Wireless a major improvement project (3 million dollars budget) that involved installing fiber optic cables, replacing antennas, connecting to network, reviewing contracts, keeping track and selecting subcontractors and third-party vendors.
•Drove various projects such as: voice command implementation, major hardware replacement (over 1,200 computers), security camera replacement and security software implementation, throughout all Gulfstream locations in the US.
Craiovan Consulting SRL			Timisoara, Romania			6/2009 – 5/2011
Project Manager Consultant
▪ Managed international relocation, construction and remodel projects.
▪ Provided support with the preparation of design, development and construction of new and major renovation projects.
▪ Interacted with governmental agencies, utilities and sub-contractors to implement the company’s real estate requirements.
▪ Performed punch list completion, financial close-out and transfer of property to customer.
▪ Defined and implemented project standards and processes for all the projects.
▪ Tracked projected versus actual project performance and informed management of accomplishments and major problem areas as well as budget and schedule status.
▪ Conducted post implementation project reviews to evaluate sustaining support and document lessons learned.
▪ Led cross-functional and virtual teams and meetings.
UnitedHealth Group				Hartford, CT				8/2002 - 5/2008
Project Coordinator
▪ Acted as a Green Belt on Six Sigma Projects involving the improvement of pharmacy submissions.
▪ Coordinated and tracked status of multiple projects for the IT Coding Department.
▪ Traced and resolved escalated ID card issues for the Key Accounts Department.
▪ Achieved savings of over $800,000 on an Operational Excellence Six Sigma Project.
▪ Collected, tracked, analyzed and reported data.
▪ Generated, analyzed and run complex reports on a daily and weekly basis as well as ad hoc reports.
▪ Researched and analyzed various projects.
▪ Hired, trained and supervised the temporary staff.",1,resumes/datasets/management\Adelina_Erimia_PMP1.docx
